Name_ga,Image_gaga,Plus,Feature,Minus,Resume,Rules,Url_game_gaga,Transliterated_name
Перекати-Ёжик,https://gaga.ru/gaga/files/images/fullsize/4662/5.jpg,яркие и привлекательные компоненты^соревновательный и кооперативный режимы игры^усложнение и вариативность правил и игрового поля^,теннисный мячик как компонент настольной игры^,не стоит играть рядом с любимой маминой вазой^понадобится довольно много пространства для игры^,Перекати-Ёжик – отличный вариант первой настольной игры для ребёнка. Простые и понятные правила в увлекательном сюжете подойдут для весёлого досуга самых маленьких исследователей.,https://gaga.ru//gaga/files/pdf/rules/ru/4662-312717.pdf,https://gaga.ru/game/perekati-ezhik/,Perekati-Ezhik
Натиск!,https://gaga.ru/gaga/files/images/fullsize/6137/25.jpg,,,,"Натиск — это 10 минут изучения правил и целый вечер напряжённого логического противостояния, потому что одной партии недостаточно — хочется играть ещё и ещё.",https://gaga.ru//gaga/files/pdf/rules/ru/6137-314004.pdf,https://gaga.ru/game/natisk/,Natisk!
Три Поросенка,https://gaga.ru/gaga/files/images/fullsize/4205/8.jpg,,,,"Три Поросенка — это яркая и веселая игра на кубиках, которая посвятит вас во все тонкости строительства собственного дома. Любимая сказка в новом формате, где главные герои — это вы.",https://gaga.ru//gaga/files/pdf/rules/ru/4205.pdf,https://gaga.ru/game/tri-porosenka/,Tri Porosenka
Для Тебя,https://gaga.ru/gaga/files/images/fullsize/1278/4.jpg,,,,"Порох рассыпан - поджигайте и превратите жизнь любимого человека в фейерверк ярких эмоций, впечатлений и чувств с игрой Для Тебя.",https://gaga.ru//gaga/files/pdf/rules/ru/1278-326054.pdf,https://gaga.ru/game/for-you/,Dlja Tebja
Мемо Достопримечательности России,https://gaga.ru/gaga/files/images/fullsize/2832/8.jpg,,,,"Вот будут у вас каникулы (отпуск), отправляйтесь путешествовать и соберите в своём списке все самые интересные туристические места! Благодаря настольной игре Мемо Достопримечательности России теперь вы знаете, что выбрать.",,https://gaga.ru/game/memo-russian-sights/,Memo Dostoprimechatel'nosti Rossii
Это Факт! Страны,https://gaga.ru/gaga/files/images/fullsize/3041/15.jpg,,,,"Азартная викторина с необычной механикой поможет вам лучше ориентироваться в карте мира. Это Факт! Страны — пожалуй, самый интересный и веселый способ учить географию.",https://gaga.ru//gaga/files/pdf/rules/ru/3041-308568.pdf,https://gaga.ru/game/it-is-a-fact-countries/,Eto Fakt! Strany
Runebound. Третья редакция,https://gaga.ru/gaga/files/images/fullsize/3149/16.jpg,,,,,https://gaga.ru//gaga/files/pdf/rules/ru/3149-340761.pdf,https://gaga.ru/game/runebound-third-edition/,Runebound. Tret'ja redaktsija
Город Мечты,https://gaga.ru/gaga/files/images/fullsize/5674/5.jpg,,,,,https://gaga.ru//gaga/files/pdf/rules/ru/5674-269876.pdf,https://gaga.ru/game/gorod-mechty/,Gorod Mechty
Сундучок Знаний. Вокруг Света,https://gaga.ru/gaga/files/images/fullsize/1556/8.jpg,,,,"С этой познавательной игрой ваш ребёнок очень скоро начнет удивлять всех своими познаниями в географии, кроме того, Сундучок Знаний. Вокруг Света развивает память и пробуждает любознательность.",,https://gaga.ru/game/sunduchok-vokrugsveta/,Sunduchok Znanij. Vokrug Sveta
Такеноко,https://gaga.ru/gaga/files/images/fullsize/1229/6.jpg,,,,"Панды, бамбук… очарование восточной гармонии. Мы уже влюбились в Такеноко, созданную талантливым автором Семи Чудес и Историй с призраками, чего желаем и вам! ;)",https://gaga.ru//gaga/files/pdf/rules/ru/1229-326021.pdf,https://gaga.ru/game/takenoko/,Takenoko
Дэни: Голоса в Голове,https://gaga.ru/gaga/files/images/fullsize/5252/9.jpg,несложные правила^можно играть в большой компании^легко взять с собой или сыграть в дороге^,,"иногда главное — не думать, откуда у мальчика Дэни такие воспоминания^","Простые правила, быстрые партии и капелька здорового сумасшествия. Дэни — это блеф, дедукция и изобретательность в одной коробке. И, конечно, море веселья. Все как мы любим :)",https://gaga.ru//gaga/files/pdf/rules/ru/5252.pdf,https://gaga.ru/game/dany/,Deni: Golosa v Golove
Кукаракула,https://gaga.ru/gaga/files/images/fullsize/5028/2.jpg,веселая игра-бродилка развивает внимание и навыки счета^яркий дизайн и красивое оформление трехмерного игрового поля^,движущийся по игровому полю нано-таракан постоянно требует внимания игроков^,метко пущенный из катапульты таракан случайно может включить в игру окружающих^,"Юные охотники на тараканов-вампиров будут в восторге от веселой игры Кукаракула, а взрослые точно не останутся равнодушными, наблюдая за этой схваткой. Рекомендуем для детского праздника или вечера в кругу семьи.",,https://gaga.ru/game/kukarakula/,Kukarakula
Мемо Удивительные Животные,https://gaga.ru/gaga/files/images/fullsize/2829/6.jpg,,,,"Настольная игра Мемо Удивительные Животные – это отличный подарок. В нём есть красивые фото, упражнение для тренировки внимательности и развития памяти и лёгкая игра для одного-четырёх человек. В компактном размере и по низкой цене. Что ещё надо для счастья?",,https://gaga.ru/game/memo-wonderful-animals/,Memo Udivitel'nye Zhivotnye
Набор дополнений к Res Arcana (Res Arcana: Lux et Tenebrae + Res Arcana: Perlae Imperii),https://gaga.ru/gaga/files/images/fullsize/6147/1.jpg,,,,,,https://gaga.ru/game/nabor-dopolnenij-k-res-arcana/,Nabor dopolnenij k Res Arcana (Res Arcana: Lux et Tenebrae + Res Arcana: Perlae Imperii)
Этажики,https://gaga.ru/gaga/files/images/fullsize/2661/5.jpg,,,,"Вот вы и нашли то, что вкусно и полезно для всей семьи. Умилительные яркие картинки, всюду воздушные шары – сложно поверить, что игра с таким оформлением учит детей азам сухой и практичной арифметики! Обучите ребёнка устному счёту быстрее, чем ремонтируется лифт :)",https://gaga.ru//gaga/files/pdf/rules/ru/2661-314867.pdf,https://gaga.ru/game/floors/,Etazhiki
Ответ-Пати,https://gaga.ru/gaga/files/images/fullsize/2785/7.jpg,"теперь вы точно не будете лезть за словом в карман^целых три режима игры для разных компаний: быстрая игра, точный подсчет и командный вариант^учимся быстро решать важные вопросы^",быстрота и реакция важнее правильных ответов^,некоторые вопросы носят деликатный характер^,"Осторожно! Эта игра вызывает привыкание, особенно если вы сентиментальны и любите собираться вместе. Ведь Ответ-Пати – этакая семейно-дружеская идиллия настольных вечеров. Просто играете и радуетесь. Правила лёгкие, игра приятная. Невольно задумаешься: и почему ещё не все люди играют? :) Так хотя бы вы не упускайте своих счастливых моментов и наслаждайтесь этими добрыми удовольствиями.",https://gaga.ru//gaga/files/pdf/rules/ru/2785.pdf,https://gaga.ru/game/declic/,Otvet-Pati
Охота на Единорогов,https://gaga.ru/gaga/files/images/fullsize/5001/6.jpg,,,,,https://gaga.ru//gaga/files/pdf/rules/ru/5001.pdf,https://gaga.ru/game/ohota_na_edinorogov/,Ohota na Edinorogov
Зомби в Школе,https://gaga.ru/gaga/files/images/fullsize/4967/5.jpg,,,,,https://gaga.ru//gaga/files/pdf/rules/ru/4967-307008.pdf,https://gaga.ru/game/zombi-v-shkole/,Zombi v Shkole
Сырный Замок,https://gaga.ru/gaga/files/images/fullsize/72/8.jpg,мультипликационное оформление очарует юных настольщиков^целая гора международных наград^,коробка трансформируется в настоящий замок^,"мышки, пойманные в ловушку, остаются там до конца игры^","Мы считаем, что это лучшая игра для игры семьей в формате дети+родители.",https://gaga.ru//gaga/files/pdf/rules/ru/72-308761.pdf,https://gaga.ru/game/syrnyy-zamok-igra/,Syrnyj Zamok
Лото Детское. Страна Чудес,https://gaga.ru/gaga/files/images/fullsize/4794/4.jpg,элементарные правила^оформление радует глаз^,смесь двух игровых механик в одной настолке^,коробка великовата для такого набора компонентов^,"Лото детское. Страна чудес – это красивая, спокойная и познавательная забава для детей от 4 лет. В ней объединились две механики: классического лото и мемори, что совершенно не усложняет игру, и она остается все такой же легкоусваиваемой и полезной.",https://gaga.ru//gaga/files/pdf/rules/ru/4794.pdf,https://gaga.ru/game/loto-detskoe-strana-chudes/,Loto Detskoe. Strana Chudes
Кодовые Имена: Глубоко под Прикрытием,https://gaga.ru/gaga/files/images/fullsize/4079/8.jpg,самая жаркая игра всей серии^столько новых открытий^,часть слов относится к категории 18+^,"чертовски стыдно^наручники не входят в комплект^игра печатается за рубежом по двойной лицензии, поэтому стоит дороже других игр серии^","Кодовые Имена: Глубоко под Прикрытием — это райдер отвязной рок-звезды. Рок-н-рольный отрыв и драйв, готовый отдаться в ваши руки.",https://gaga.ru//gaga/files/pdf/rules/ru/4079-308091.pdf,https://gaga.ru/game/codenames-deep-undercover/,Kodovye Imena: Gluboko pod Prikrytiem
Зоопарк Нью-Йорка,https://gaga.ru/gaga/files/images/fullsize/5815/24.jpg,,,,,https://gaga.ru//gaga/files/pdf/rules/ru/5815.pdf,https://gaga.ru/game/zoopark-nyu-jorka/,Zoopark N'ju-Jorka
Время Приключений: Карточные Войны. Снежный Король против Марселин,https://gaga.ru/gaga/files/images/fullsize/4806/5.jpg,,,,,https://gaga.ru//gaga/files/pdf/rules/ru/4806.pdf,https://gaga.ru/game/vremja-prikljuchenij-snezhnij-korol-protiv-marselin/,Vremja Prikljuchenij: Kartochnye Vojny. Snezhnyj Korol' protiv Marselin
Эрудит,https://gaga.ru/gaga/files/images/fullsize/52/4.jpg,,,,"В отличие от другой классической игры Монополии, Скрэббл не потерял своей актуальности до сих пор и, вероятно, сохранит свои позиции в будущем. Эта игра прекрасно подходит и детям, и взрослым, для игры в кругу семьи или в компании друзей. Рекомендуем каждой семье.",https://gaga.ru//gaga/files/pdf/rules/ru/52-308493.pdf,https://gaga.ru/game/erudit/,Erudit
Red7,https://gaga.ru/gaga/files/images/fullsize/3844/6.jpg,,,,,https://gaga.ru//gaga/files/pdf/rules/ru/3844-308607.pdf,https://gaga.ru/game/red-seven/,Red7
Находка для Шпиона,https://gaga.ru/gaga/files/images/fullsize/2470/11.jpg,,,,"Превосходная игра для вечеринок с нетривиальным сюжетом и отличным оформлением. Смело отправляйтесь на задание, и помните: болтун – находка для шпиона!",https://gaga.ru//gaga/files/pdf/rules/ru/2470-310299.pdf,https://gaga.ru/game/naxodka-dlja-shpiona/,Nahodka dlja Shpiona
Второй Шанс. Смерть Музыканта,https://gaga.ru/gaga/files/images/fullsize/4902/3.jpg,,,,,,https://gaga.ru/game/vtoroj-shans-smert-muzykanta/,Vtoroj Shans. Smert' Muzykanta
Манчкин Квест,https://gaga.ru/gaga/files/images/fullsize/37/12.jpg,,,,Красочная и наглядная переработка привычного Манчкина. Фирменный юмор и обилие возможностей персонажа (спец. карточки Deus ex Munchkin) не оставят равнодушным ни одного любителя ролевых игр. Купить настольную игру Манчкин Квест рекомендуется всем поклонникам серии. Вынести собственное суждение о нововведениях можно только в процессе игры.,https://gaga.ru//gaga/files/pdf/rules/ru/37-326050.pdf,https://gaga.ru/game/munchkin-quest/,Manchkin Kvest
Монополия Реванш,https://gaga.ru/gaga/files/images/fullsize/5458/2.jpg,,,,,,https://gaga.ru/game/monopoliya-revansh/,Monopolija Revansh
Пей! Пей! Пей!,https://gaga.ru/gaga/files/images/fullsize/5461/10.jpg,,,,"Готовы устроить турнир по боям на пальцах, сделать пьяное фото и зарифмовать парочку тостов? Тогда обновляйте напитки в стаканах и открывайте Пей! Пей! Пей!",https://gaga.ru//gaga/files/pdf/rules/ru/5461-308041.pdf,https://gaga.ru/game/pey-pey-pey/,Pej! Pej! Pej!
Карманный Детектив. Дело 1: Убийство в Университете,https://gaga.ru/gaga/files/images/fullsize/4944/3.jpg,все правила и действия напечатаны на картах — легко начать игру и погрузиться в расследование^отличная альтернатива детективному сериалу или книге^,"играть можно одному или обсуждать версии с друзьями, но решение остается за игроком, который ходит в данный момент^",расследовать дело можно только один раз^,Карманный Детектив. Дело № 1: Убийство В Университете — легкая и затягивающая карточная игра на развитие сюжета и расследование. Отличный старт для изучения более масштабных детективных игр.,,https://gaga.ru/game/karmannyj-detektiv-ubijstvo-v-universitete/,Karmannyj Detektiv. Delo 1: Ubijstvo v Universitete
Лоскутное Королевство: Дуэль Гербов,https://gaga.ru/gaga/files/images/fullsize/5297/5.jpg,,,,,https://gaga.ru//gaga/files/pdf/rules/ru/5297.pdf,https://gaga.ru/game/kingdomino-duel-gerbov/,Loskutnoe Korolevstvo: Duel' Gerbov
Pixel Tactics,https://gaga.ru/gaga/files/images/fullsize/2578/14.jpg,большие сражения в компактной упаковке^широкие возможности для тактики^десятки уникальных героев и воинов с индивидуальными особенностями^,"многофункциональные карты, изменяющие свои свойства в зависимости от способа использования^олдскульная пиксельная графика^",мелкий шрифт на картах^,"Pixel Tactics — это нестандартный взгляд на дуэльные настольные игры, подкупающий своей вариативностью и реиграбельностью. Благодаря простым правилам и олдскульному восьмибитному оформлению, игра порадует как старых матерых гиков, так и начинающих любителей хороших настолок.",https://gaga.ru//gaga/files/pdf/rules/ru/2578-341527.pdf,https://gaga.ru/game/pixel-tactics/,Pixel Tactics
Звездный Манчкин,https://gaga.ru/gaga/files/images/fullsize/35/3.jpg,,,,"Достойное продолжение надругательств над настольными играми. Все такая же веселая игра для общительных и необидчивых людей, которые не будут относиться к ней очень серьезно :)",https://gaga.ru//gaga/files/pdf/rules/ru/35-327622.pdf,https://gaga.ru/game/star-munchkin/,Zvezdnyj Manchkin
Фрукто 10,https://gaga.ru/gaga/files/images/fullsize/2027/7.jpg,,,,"Фрукто-10 пригодится всем карапузам дошкольного и младшего школьного возраста, а особенно тем, кто испытывает трудности с цифрами и устным счётом. А ещё – это хорошее методическое пособие для учителей при проведении внеклассных (а, вполне возможно, и классных) занятий и оригинальный способ привлечь внимание детей к предмету.",https://gaga.ru//gaga/files/pdf/rules/ru/2027-314770.pdf,https://gaga.ru/game/fructo-ten/,Frukto 10
Концепт,https://gaga.ru/gaga/files/images/fullsize/2337/17.jpg,,,,"Оригинальная настольная игра с любопытной игровой механикой. Концепт может быть как игрой для вечеринок, так и развлечением для узкого семейного круга – он идеально впишется в любую компанию и подарит всем участникам массу эстетического, интеллектуального и просто беззаботно-игрового удовольствия.",https://gaga.ru//gaga/files/pdf/rules/ru/2337-327261.pdf,https://gaga.ru/game/concept/,Kontsept
Моя Первая Осада Замка,https://gaga.ru/gaga/files/images/fullsize/4970/6.jpg,,,,,https://gaga.ru//gaga/files/pdf/rules/ru/4970.pdf,https://gaga.ru/game/my-first-castle-panic/,Moja Pervaja Osada Zamka
Сплэш!,https://gaga.ru/gaga/files/images/fullsize/2682/5.jpg,,,,"Отличная игра для семьи и компании. Стремитесь, чтобы все ваши старания разрушил кто-то слева, подбирайте элемент правильной формы :) Классная придумка для тех, кто не прочь повеселиться при минимуме действий со своей стороны.",https://gaga.ru//gaga/files/pdf/rules/ru/2682-312550.pdf,https://gaga.ru/game/splash/,Splesh!
Челюсти (Ravensburger),https://gaga.ru/gaga/files/images/fullsize/5596/2.jpg,,,,,,https://gaga.ru/game/chelyusti-ravensburger/,Cheljusti (Ravensburger)
Спасите Дино,https://gaga.ru/gaga/files/images/fullsize/4919/11.jpg,простые правила^красочное оформление^кооперативный режим – все игроки вместе выигрывают или вместе проигрывают^,четыре фигурки самых милых динозавриков во всей долине^,взрослым предстоит играть с детьми вновь и вновь :)^,"Спасите Дино – отличный способ хорошо провести время всей семьей. Яркое оформление, простые правила и очень милые фигурки динозавров – что еще нужно, чтобы надолго увлечь ребенка? :)",https://gaga.ru//gaga/files/pdf/rules/ru/4919-308309.pdf,https://gaga.ru/spasite-dino/,Spasite Dino
Мемори. Монстрики,https://gaga.ru/gaga/files/images/fullsize/3766/6.jpg,,,,,,https://gaga.ru/game/memory-monstriki/,Memori. Monstriki
Мерв,https://gaga.ru/gaga/files/images/fullsize/6025/24.jpg,по-восточному красочное и атмосферное оформление^минимальная доля случайности^оригинальное сочетание игровых механик поля и определения очерёдности хода^,плотное взаимодействие игроков и высокая конкуренция^необычный соло-режим с двумя ботами^,довольно высокий порог вхождения^любители просчитать всё наперёд могут зависнуть или даже впасть в аналитический паралич^,"Мерв — идеально сбалансированная, комплексная, красочная и невероятно тематичная стратегия — точно сверкающий драгоценный камень среди представителей жанра.",https://gaga.ru//gaga/files/pdf/rules/ru/6025.pdf,https://gaga.ru/game/merv-the-heart-of-the-silk-road/,Merv
Бэнг! Звёздные Войны,https://gaga.ru/gaga/files/images/fullsize/5357/7.jpg,,,,,https://gaga.ru//gaga/files/pdf/rules/ru/5357.pdf,https://gaga.ru/game/beng-zvyozdnye-vojny/,Beng! Zvezdnye Vojny
7 Чудес. Дуэль,https://gaga.ru/gaga/files/images/fullsize/3130/11.jpg,,,,Старые добрые 7 Чудес открывают для себя новые горизонты. Теперь у вас есть прекрасная возможность сойтись с оппонентами в жаркой дуэли. Самостоятельная игра на базе полюбившейся механики не оставит никого равнодушным.,https://gaga.ru//gaga/files/pdf/rules/ru/3130-308756.pdf,https://gaga.ru/game/7-wonders-duel/,7 Chudes. Duel'
Русское Лото,https://gaga.ru/gaga/files/images/fullsize/138/6.jpg,,,,"Настоящий динозавр мира настольных игр, Русское Лото теперь еще и в русско-народном ларце будет верно хранить лучшие игровые традиции в вашем доме и терпеливо ждать, когда вы состаритесь или устанете от всех других настольных игр в мире. :) Ну и, конечно же, прекрасный подарок представителям старшего поколения.",https://gaga.ru//gaga/files/pdf/rules/ru/138.pdf,https://gaga.ru/game/russkoe-loto-kupit/,Russkoe Loto
