Name_ga,Image_gaga,Plus,Feature,Minus,Resume,Rules,Url_game_gaga,Transliterated_name
Взрывные Котята. Взрослая Версия 18+,https://gaga.ru/gaga/files/images/fullsize/4925/4.jpg,элементарные правила и механика^подходит игрокам с аллергией на шерсть^,"если объединить колоды из базы и 18+, то можно сыграть компанией до 9 человек^",поборники морали не поймут^после игры хочется постоять под душем подольше и полежать в позе ребенка 15 минут^,"Взрывные Котята. Взрослая Версия 18+ — карточное воплощение взрывоопасного кошачьего характера. Членовредительство, поедание непредназначенных для этого вещей, доказательства заговора против человечества включены.",https://gaga.ru//gaga/files/pdf/rules/ru/4925-308006.pdf,https://gaga.ru/vzrivnie-kotyata-18-plus/,Vzryvnye Kotjata. Vzroslaja Versija 18+
Свинтус Злоключения,https://gaga.ru/gaga/files/images/fullsize/5346/5.jpg,,,,,https://gaga.ru//gaga/files/pdf/rules/ru/5346.pdf,https://gaga.ru/game/svintus-zloklyucheniya/,Svintus Zlokljuchenija
Колонизаторы Джуниор,https://gaga.ru/gaga/files/images/fullsize/363/10.jpg,,,,"Став доступными для детей, Колонизаторы Джуниор получили новое яркое оформление и упрощенные правила, но не потеряли ни одной черты, за которую мы так любим классическую версию игры. А поэтому играть будет весело всей семье, вне зависимости от возраста!",https://gaga.ru//gaga/files/pdf/rules/ru/363-331436.pdf,https://gaga.ru/game/363/,Kolonizatory Dzhunior
Сад Алисы,https://gaga.ru/gaga/files/images/fullsize/5011/4.jpg,,,,,https://gaga.ru//gaga/files/pdf/rules/ru/5011.pdf,https://gaga.ru/game/sad-alisy/,Sad Alisy
Тёмные Истории 2,https://gaga.ru/gaga/files/images/fullsize/2353/7.jpg,,,,"Больше крови, больше смертей, больше загадок! Тёмные Истории 2 – продолжение популярной серии мрачных Данеток, игра, которая определенно порадует любителей запутанных преступлений и толп мурашек, бегающих по спине ;)",https://gaga.ru//gaga/files/pdf/rules/ru/2353-329381.pdf,https://gaga.ru/game/black-stories-two/,Temnye Istorii 2
Кахут,https://gaga.ru/gaga/files/images/fullsize/4537/6.jpg,,,,,https://gaga.ru//gaga/files/pdf/rules/ru/4537-317291.pdf,https://gaga.ru/game/kahut/,Kahut
КвестМастер. Загадка Эльдорадо,https://gaga.ru/gaga/files/images/fullsize/4452/4.jpg,,,,,,https://gaga.ru/game/kvestmaster-zagadka-eldorado/,KvestMaster. Zagadka El'dorado
Монстр по Соседству,https://gaga.ru/gaga/files/images/fullsize/4191/7.jpg,скоростные раунды^интрига сохраняется до самого конца^,иллюстрации в стиле аниме^каждый монстр обладает своей уникальной способностью^,мирные жители ничего не решают^,"Монстр по Соседству — это быстрая игра, наполненная блефом и подозрениями. Компактный шедевр, который лишний раз напомнит, что к незнакомцам стоит относиться со всей осторожностью.",https://gaga.ru//gaga/files/pdf/rules/ru/4191-308095.pdf,https://gaga.ru/game/monstr-po-sosedstvu/,Monstr po Sosedstvu
"Пёсики, вперёд!",https://gaga.ru/gaga/files/images/fullsize/4496/18.jpg,,,,"Если вы в восторге от собак и весёлых игр на скорость, то Пёсики, вперёд  — то, что нужно. Очаровательная головоломка для всей семьи — яркая и красочная, как цирковое представление.",https://gaga.ru//gaga/files/pdf/rules/ru/4496-341582.pdf,https://gaga.ru/game/pesiki-vpered/,"Pesiki, vpered!"
Карманный Детектив. Дело 3: Время на Исходе,https://gaga.ru/gaga/files/images/fullsize/5280/3.jpg,,,,,,https://gaga.ru/game/karmannyj-detektiv-vremya-na-ishode/,Karmannyj Detektiv. Delo 3: Vremja na Ishode
Двор Чудес. Королевство Парижских Бродяг,https://gaga.ru/gaga/files/images/fullsize/5488/8.jpg,,,,,https://gaga.ru//gaga/files/pdf/rules/ru/5488-312358.pdf,https://gaga.ru/game/dvor-chudes-korolevstvo-parizhskih-brodyag/,Dvor Chudes. Korolevstvo Parizhskih Brodjag
Гномы-Вредители Делюкс,https://gaga.ru/gaga/files/images/fullsize/985/11.jpg,гномы (почти как в сказке)^строим шахту своими руками^подойдет крупной компании^,увлекательное дополнение внутри^,вредители (почти как в жизни)^атмосфера тотальной паранойи и недоверия^,"Саботёр - игра динамичная, быстрая, подогревающая общение, заставляющая думать, но и не перенапрягающая мозг. Отличнейший party-вариант для большой и весёлой компании.",https://gaga.ru//gaga/files/pdf/rules/ru/985-308037.pdf,https://gaga.ru/game/saboteur2/,Gnomy-Vrediteli Deljuks
Мемо Москва,https://gaga.ru/gaga/files/images/fullsize/2833/7.jpg,,,,"Это один из самых патриотичных наборов Мемо, который мы видели. Наравне с гимном РФ и селёдкой под шубой эта игра приучит вашего ребёнка быть внимательным и в чём угодно видеть памятник Минину и Пожарскому :)",,https://gaga.ru/game/memo-moscow/,Memo Moskva
Летчик Луи,https://gaga.ru/gaga/files/images/fullsize/2516/7.jpg,"уникальная конструкция с настоящим самолетом, летающим по кругу^восхитительное исполнение всех пластиковых компонентов^",можно регулировать сложность индивидуально для каждого игрока^,"отсутствуют запасные жетоны куриц, поэтому нужно аккуратно относиться к деталям и не терять их^","Летчик Луи — игра, заслужившая множество наград и высоких оценок за рубежом, теперь добралась и до нас. Заводите мотор! Пора помочь Луи покорить небеса, а заодно защитить от его самолета своих куриц.",https://gaga.ru//gaga/files/pdf/rules/ru/2516-307605.pdf,https://gaga.ru/game/looping-louie/,Letchik Lui
Элементарно! Для Детей. Тайна Пропавшего Суриката,https://gaga.ru/gaga/files/images/fullsize/4923/3.jpg,,,,"Элементарно! – это замечательная игра для всех любителей детективных сериалов и тру-крайма. Короткие и увлекательные дела не займут много времени и не требуют особой подготовки, но при этом принесут массу удовольствия. Отличный способ проверить свои дедуктивные способности и логику.",https://gaga.ru//gaga/files/pdf/rules/ru/4923.pdf,https://gaga.ru/elementarno-dlya-detey-tajna-propavshego-surikata/,Elementarno! Dlja Detej. Tajna Propavshego Surikata
Экономикус,https://gaga.ru/gaga/files/images/fullsize/3905/6.jpg,,,,,https://gaga.ru//gaga/files/pdf/rules/ru/3905.pdf,https://gaga.ru/game/economicus/,Ekonomikus
Exit Квест. Комната Страха,https://gaga.ru/gaga/files/images/fullsize/5171/3.jpg,,,,,https://gaga.ru//gaga/files/pdf/rules/ru/5171.pdf,https://gaga.ru/game/exit-komnata-straha/,Exit Kvest. Komnata Straha
Зомби в Доме. Заражение,https://gaga.ru/gaga/files/images/fullsize/5633/7.jpg,"бомбически крутое оформление^красочные и объемные сборные игровые элементы^правила все такие же простые, а впечатлений гораздо больше^",коробка с игрой превращается в трехмерное игровое поле^даже растерзанные монстрами персонажи продолжают игру^,"не советуем тем, кто не любит зомби и рандом^",Непревзойденный апгрейд уже полюбившейся кооперативной игры про спасение от зомби придется по вкусу настольщикам всех возрастов и предпочтений.,https://gaga.ru//gaga/files/pdf/rules/ru/5633-308983.pdf,https://gaga.ru/game/zombi-v-dome-zarazhenie/,Zombi v Dome. Zarazhenie
Нечто,https://gaga.ru/gaga/files/images/fullsize/2742/9.jpg,,,,"Муа-ха-ха! Эта психологическая игра будет держать вас в напряжении до финала и заставит вздрогнуть в конце! Мрачная атмосфера и перспектива потерять всю команду – а может, она уже потеряна? Игра отлично подойдёт для корпоратива или вечера с друзьями, только бабушку пощадите, не показывайте.",https://gaga.ru//gaga/files/pdf/rules/ru/2742-308495.pdf,https://gaga.ru/game/stay-away/,Nechto
Экипаж. Экспедиция к Девятой Планете,https://gaga.ru/gaga/files/images/fullsize/5369/7.jpg,,,,,https://gaga.ru//gaga/files/pdf/rules/ru/5369.pdf,https://gaga.ru/game/ekipazh-ekspediciya-k-devyatoj-planete/,Ekipazh. Ekspeditsija k Devjatoj Planete
Солнечный Шторм,https://gaga.ru/gaga/files/images/fullsize/6188/11.jpg,"все игроки в одной команде – а значит, побеждают или проигрывают вместе^серьёзная стратегия в компактной коробке^порадует как опытных настольщиков, так и начинающих игроков^",можно играть одному^,проиграть можно буквально в любую минуту^,"Небольшая коробка, простые правила, быстрые партии и действительно захватывающее испытание для всех любителей кооперативных игр — Солнечный Шторм определённо порадует не только новичком в мире настолок, но и прожжённых гиков.",https://gaga.ru//gaga/files/pdf/rules/ru/6188-308090.pdf,https://gaga.ru/game/solar-storm/,Solnechnyj Shtorm
Первый Контакт,https://gaga.ru/gaga/files/images/fullsize/4476/6.jpg,,,,,https://gaga.ru//gaga/files/pdf/rules/ru/4476.pdf,https://gaga.ru/game/pervii-kontakt/,Pervyj Kontakt
Много-Много,https://gaga.ru/gaga/files/images/fullsize/2309/4.jpg,,,,"Еще один миф о сложностях образования успешно развенчан Бандой Умников! Таблица умножения покажется вам проще пареной репы, если вы подготовитесь к встрече с ней при помощи образовательно-развлекательной настольной игры Много-Много!",https://gaga.ru//gaga/files/pdf/rules/ru/2309-314680.pdf,https://gaga.ru/game/mnogo-mnogo/,Mnogo-Mnogo
Бэнг! Дуэль,https://gaga.ru/gaga/files/images/fullsize/2962/9.jpg,,,,"Перед нами все тот же старый добрый вестерн, только теперь в версии для двоих. Конечно, не хватает масштабности оригинала, когда помимо безумной стрельбы всех окружала тотальная паранойя, но зато теперь можно романтично отправиться на Дикий Запад только вдвоем и устроить настоящий поединок в духе фильма Быстрый и Мёртвый.",https://gaga.ru//gaga/files/pdf/rules/ru/2962.pdf,https://gaga.ru/game/bang-the-duel/,Beng! Duel'
Китайские Шашки (Philos),https://gaga.ru/gaga/files/images/fullsize/4940/2.jpg,,,,,https://gaga.ru//gaga/files/pdf/rules/ru/4940.pdf,https://gaga.ru/game/kitajskie-shashki/,Kitajskie Shashki (Philos)
Живые Истории,https://gaga.ru/gaga/files/images/fullsize/4992/6.jpg,,,,,https://gaga.ru//gaga/files/pdf/rules/ru/4992.pdf,https://gaga.ru/game/jivie-istirii/,Zhivye Istorii
Тролль и Дракон,https://gaga.ru/gaga/files/images/fullsize/4818/15.jpg,,,,"Тролль и Дракон отлично подойдет как юным кладоискателям, так и их родителям. Быстрая, веселая и азартная — эта игра точно никого не оставит равнодушным.",https://gaga.ru//gaga/files/pdf/rules/ru/4818.pdf,https://gaga.ru/game/drakon-troll/,Troll' i Drakon
"Таверна Красный Дракон: Эльф, Русалки и Бутылка Рома",https://gaga.ru/gaga/files/images/fullsize/4664/6.jpg,,,,,https://gaga.ru//gaga/files/pdf/rules/ru/4664.pdf,https://gaga.ru/game/taverna-krasnii-drakon-elf-rusalki-i-butilka-roma/,"Taverna Krasnyj Drakon: El'f, Rusalki i Butylka Roma"
"Торре, Сорви Башню!",https://gaga.ru/gaga/files/images/fullsize/5029/3.jpg,,,,"Торре. Сорви Башню! — это яркий подарок, настоящий настольный хит, душа любой вечеринки и герой многочасового семейного досуга с самыми взыскательными юными участниками.",,https://gaga.ru/game/torre-sorvi-bashnyu/,"Torre, Sorvi Bashnju!"
Монополия Сделка,https://gaga.ru/gaga/files/images/fullsize/182/7.jpg,,,,,https://gaga.ru//gaga/files/pdf/rules/ru/182-327057.pdf,https://gaga.ru/game/monolopydeal/,Monopolija Sdelka
Билет на Поезд по Европе,https://gaga.ru/gaga/files/images/fullsize/104/6.jpg,,,,"Настольная игра Билет на поезд по Европе, её паровозики, вагончики, билеты и карта старой Европы - это игра-приключение и игра-впечатление в одном флаконе в одной коробке. Это одна из тех игр, в которую, закончив партию, хочется сразу же сыграть ещё. И одна из лучших настольных игр в мире!",https://gaga.ru//gaga/files/pdf/rules/ru/104-325383.pdf,https://gaga.ru/game/ticket-to-ride-europe/,Bilet na Poezd po Evrope
Codex. Базовый набор,https://gaga.ru/gaga/files/images/fullsize/3742/10.jpg,ощущение построения колоды в режиме реального времени^отсылки к любимым настольным и компьютерным играм^победа зависит от умения игроков^,в комплект входят кодексы — специальные альбомы для каждой фракции^,"в первых партиях требуется время, чтобы изучить свойства всех карт^","Codex — это результат десятилетней работы по созданию игры, которая позволит посмотреть на коллекционные карточные игры с совершенно другого ракурса.",https://gaga.ru//gaga/files/pdf/rules/ru/3742.pdf,https://gaga.ru/game/codex-core-set/,Codex. Bazovyj nabor
Кортекс,https://gaga.ru/gaga/files/images/fullsize/3272/8.jpg,,,,,https://gaga.ru//gaga/files/pdf/rules/ru/3272.pdf,https://gaga.ru/game/cortex/,Korteks
Тик Так Бумм Вечеринка,https://gaga.ru/gaga/files/images/fullsize/444/5.jpg,,,,Взрывная и невероятно веселая суперверсия любимого Тик Так Бумма сделает каждую вашу вечеринку незабываемой и сумасшедше веселой!,https://gaga.ru//gaga/files/pdf/rules/ru/444-327646.pdf,https://gaga.ru/game/ticktackbummparty/,Tik Tak Bumm Vecherinka
Русский Манчкин,https://gaga.ru/gaga/files/images/fullsize/5307/5.jpg,уморительные и стильные авторские иллюстрации^много крутых и легко читаемых отсылок^,новая механика со сменой времен года^можно смешать с другими наборами и дополнениями серии^,беспощадный рандом порой заставляет надеяться только на русский авось^слезы ностальгии значительно сокращают угол обзора^,"Веселая карточная игра для любой компании, получив множество изданий и версий, стала, наконец, русской народной забавой — извольте радоваться сами да друзей развлекать!",https://gaga.ru//gaga/files/pdf/rules/ru/5307-309715.pdf,https://gaga.ru/game/russkij-manchkin/,Russkij Manchkin
Дуэль Двух Миров,https://gaga.ru/gaga/files/images/fullsize/3552/6.jpg,,,,"Дуэль Двух Миров — занимательная стратегия, прекрасно передающая ощущение схватки двух могучих армий, которые никак не могут потеснить друг друга. Этакое перетягивание каната, наполненное мифическими существами и мощными заклинаниями.",https://gaga.ru//gaga/files/pdf/rules/ru/3552.pdf,https://gaga.ru/game/duel-mirov/,Duel' Dvuh Mirov
Номер 9,https://gaga.ru/gaga/files/images/fullsize/3915/6.jpg,,,,,https://gaga.ru//gaga/files/pdf/rules/ru/3915.pdf,https://gaga.ru/game/nomer-9/,Nomer 9
Exit-Квест. Ограбление на Миссисипи,https://gaga.ru/gaga/files/images/fullsize/5325/2.jpg,,,,,https://gaga.ru//gaga/files/pdf/rules/ru/5325.pdf,https://gaga.ru/game/exit-kvest-ograblenie-na-missisipi/,Exit-Kvest. Ograblenie na Missisipi
Путь Лепестка,https://gaga.ru/gaga/files/images/fullsize/5134/6.jpg,,,,,https://gaga.ru//gaga/files/pdf/rules/ru/5134.pdf,https://gaga.ru/game/put-lepestka/,Put' Lepestka
Печенька 2.0,https://gaga.ru/gaga/files/images/fullsize/2517/11.jpg,дедуктивные загадки^интересно даже вдвоем^печенька!^,необычные персонажи^жетоны монет в рублях^,иногда удача помогает больше логики^одному играть по-прежнему нельзя^,"Печенька — это простая и быстрая настольная игра, которая заставит вас напрячь извилины, запоминая и вычисляя, кем же являются персонажи, однако, в отличие от пресловутой Мафии, дрожащие пальцы игрока напротив или странное поведения товарища слева вам не помогут — вам поможет только логика, хорошая память, наблюдательность и, конечно же, удача!",https://gaga.ru//gaga/files/pdf/rules/ru/2517-308641.pdf,https://gaga.ru/game/pechenka/,Pechen'ka 2.0
Опасные Слова,https://gaga.ru/gaga/files/images/fullsize/4656/2.jpg,,,,,https://gaga.ru//gaga/files/pdf/rules/ru/4656-308311.pdf,https://gaga.ru/game/opasnie-slova/,Opasnye Slova
Абалон,https://gaga.ru/gaga/files/images/fullsize/2244/6.jpg,,,,"Минимум правил, минимум компонентов, минимум игроков, максимум удовольствия игрового, интеллектуального и эстетического. Пришло время позвать старого друга, заварить вкусного чая, включить любимую музыку и сразиться в Абалон!",https://gaga.ru//gaga/files/pdf/rules/ru/2244-307416.pdf,https://gaga.ru/game/abalone/,Abalon
Пираты,https://gaga.ru/gaga/files/images/fullsize/4220/7.jpg,,,,"Пираты – это чрезвычайно реалистичное морское приключение в лаконичном формате. Пусть ваш Веселый Роджер весело развевается, когда вы пойдете на абордаж.",https://gaga.ru//gaga/files/pdf/rules/ru/4220.pdf,https://gaga.ru/game/piraty/,Piraty
Миры Ктулху,https://gaga.ru/gaga/files/images/fullsize/3025/9.jpg,ваши соперники не будут долго раздумывать^множество способов для построения хитрых комбинаций^удобные и понятные пиктограммы на картах^,"возможность призвать Древних^прекрасна для партий на двоих, но правила адаптированы и для 3-4 игроков^","мрачная тематика миров Лавкрафта, несмотря на красочные иллюстрации, понравится только самым отважным детям^","Похоже, что у нас появился новый фаворит среди настолок для двух игроков, хотя Миры Ктулху можно покорять и с большим количеством участников. Однозначный маст хэв для всех поклонников Лавкрафта или Доминиона. Элегантная, захватывающая и умная стратегия излечит ваш разум от забот и плохого настроения не хуже лечебницы Аркхэма.",https://gaga.ru//gaga/files/pdf/rules/ru/3025-345057.pdf,https://gaga.ru/game/cthulhu-realms/,Miry Ktulhu
Зообильярд,https://gaga.ru/gaga/files/images/fullsize/950/3.jpg,,,,"""Вкус, знакомый с детства""... Что еще можно добавить?",,https://gaga.ru/game/zoobilyard/,Zoobil'jard
День Вождей,https://gaga.ru/gaga/files/images/fullsize/2651/8.jpg,,,,"Маленькие вожди индейского племени в рабочих комбинезонах так и ждут возможности разнести ваш дом по кусочкам! Семейная и тёплая, эта игра на двоих-шестерых храбрецов разного возраста помогает почувствовать, что вот оно, счастье – бегает тут и лимон лижет :)",https://gaga.ru//gaga/files/pdf/rules/ru/2651.pdf,https://gaga.ru/game/day-of-leaders/,Den' Vozhdej
Adventure Games. Подземелье,https://gaga.ru/gaga/files/images/fullsize/5230/2.jpg,,,,,https://gaga.ru//gaga/files/pdf/rules/ru/5230-312604.pdf,https://gaga.ru/game/adventures-games-podzemelie/,Adventure Games. Podzemel'e
Крокодил ВсякоРазный,https://gaga.ru/gaga/files/images/fullsize/2626/2.jpg,,,,"Человеческий мозг может запомнить информацию, хранящуюся в самых крупных библиотеках мира! ВсякоРазный – это ооооогромный диапазон знаний, большинство которых случайным образом вам известны. Выясните, как вы гениальны и артистичны, сыграв в новую версию Крокодила!",https://gaga.ru//gaga/files/pdf/rules/ru/2626-309745.pdf,https://gaga.ru/game/crocodile-various/,Krokodil VsjakoRaznyj
