Name_ga,Image_gaga,Plus,Feature,Minus,Resume,Rules,Url_game_gaga,Transliterated_name
Лоскутное Королевство. Истоки,https://gaga.ru/gaga/files/images/fullsize/6262/7.jpg,"элементарные правила, знакомая механика^качественные компоненты составляют образцовый набор для выживания — от заостренных камней до малюток-мамонтов^","целых три режима игры различной сложности, которые понравятся и новичкам, и продвинутым игрокам^новый тип местности может круто изменить даже весьма плачевную ситуацию^","хоть доисторический мир и считается примитивным, в нём довольно много нюансов, с которыми стоит ознакомиться заранее^","Лоскутное Королевство: Истоки определенно понравится поклонникам всей серии, поможет постепенно повысить сложность совместных игр с юными игроками и привлечь к настолкам старшее поколение. Базовые правила схватываются на лету, игровой процесс не затянут, качественный органайзер и красочные компоненты идеально подходят друг другу. Игра помогает собрать семью за общим столом и уютно провести время вместе, как сотни тысяч лет назад у древнего костра объединялась вся община.",https://gaga.ru//gaga/files/pdf/rules/ru/6262.pdf,https://gaga.ru/game/loskutnoe-korolevstvo-istoki/,Loskutnoe Korolevstvo. Istoki
Бэнг! На несколько карточек больше,https://gaga.ru/gaga/files/images/fullsize/2686/7.jpg,,,,"Дополнение для опытных ковбоев. Так что если вы знаете Бэнг! как свои пять пальцев, настало время привнести новых событий в вашу ставшую чересчур размеренной жизнь. И смотрите, не упустите теперь победу! Вот она бежит, стреляй, стреляй!",https://gaga.ru//gaga/files/pdf/rules/ru/2686.pdf,https://gaga.ru/game/bang-a-fistful-of-cards/,Beng! Na neskol'ko kartochek bol'she
Шахматы + Шашки + Нарды 30 см,https://gaga.ru/gaga/files/images/fullsize/6164/4.jpg,,,,,,https://gaga.ru/game/shahmaty-shashki-nardy-3v1-30sm-bondibon/,Shahmaty + Shashki + Nardy 30 sm
Сундучок Знаний. ABC,https://gaga.ru/gaga/files/images/fullsize/2343/9.jpg,,,,"Absolutely great! Сундучок Знаний АВС – это не просто прекрасный способ сделать первые шаги в изучении английского языка, но и отличный тренажер для ума, развивающий память и внимание к деталям как у детей, так и у их родителей.",https://gaga.ru//gaga/files/pdf/rules/ru/2343-332309.pdf,https://gaga.ru/game/sunduchok-znaniy-abc/,Sunduchok Znanij. ABC
The Prodigals Club,https://gaga.ru/gaga/files/images/fullsize/3641/8.jpg,,,,,https://gaga.ru//gaga/files/pdf/rules/ru/3641.pdf,https://gaga.ru/game/prodigals-club/,The Prodigals Club
Андор. Новые Герои,https://gaga.ru/gaga/files/images/fullsize/5561/2.jpg,,,,,https://gaga.ru//gaga/files/pdf/rules/ru/5561-342030.pdf,https://gaga.ru/game/andor-novye-geroi/,Andor. Novye Geroi
Бухта Торговцев. Хозяин Таверны,https://gaga.ru/gaga/files/images/fullsize/6665/4.jpg,,,,,,https://gaga.ru/game/buhta-torgovcev-hozjain-taverny/,Buhta Torgovtsev. Hozjain Taverny
Зомбицид. Вторая Редакция. Зомби и Спутники,https://gaga.ru/gaga/files/images/fullsize/5816/6.jpg,,,,,,https://gaga.ru/game/zombicid-vtoraya-redakciya-zombi-i-sputniki/,Zombitsid. Vtoraja Redaktsija. Zombi i Sputniki
Набор Unmatched,https://gaga.ru/gaga/files/images/fullsize/6135/1.jpg,,,,,,https://gaga.ru/game/nabor-unmatched/,Nabor Unmatched
Советская кухня,https://gaga.ru/gaga/files/images/fullsize/6625/3.jpg,,,,,https://gaga.ru//gaga/files/pdf/rules/ru/6625.pdf,https://gaga.ru/game/sovetskaia-kuhnya/,Sovetskaja kuhnja
Мачи Коро Шарп,https://gaga.ru/gaga/files/images/fullsize/2529/6.jpg,,,,"В общем, если вы прониклись увлекательным градостроительством в стране непуганых сакур и искренне полюбили лаконично оформленную карточную стратегию с экзотическим названием Мачи Коро, то это дополнение определенно создано для того, чтобы сделать вас счастливее :)",https://gaga.ru//gaga/files/pdf/rules/ru/2529-311114.pdf,https://gaga.ru/game/machi-koro-sharp/,Machi Koro Sharp
Остров Кошек: Набор Предзаказа 2,https://gaga.ru/gaga/files/images/fullsize/6565/9.jpg,,,,"Так приятно, когда любимая игра сверкает новыми гранями, а вечера в кругу семьи или друзей, посвященные спасению разноцветных кошек с острова, становятся интереснее.",https://gaga.ru//gaga/files/pdf/rules/ru/6565.pdf,https://gaga.ru/game/ostrov-koshek-nabor-predzakaza-2/,Ostrov Koshek: Nabor Predzakaza 2
Умная Сова. Любимые Сказки 1,https://gaga.ru/gaga/files/images/fullsize/6238/5.jpg,,,,,,https://gaga.ru/game/umnaya-sova-lyubimye-skazki-1/,Umnaja Sova. Ljubimye Skazki 1
Top Trumps: Марвел Мстители,https://gaga.ru/gaga/files/images/fullsize/3504/7.jpg,,,,,,https://gaga.ru/game/top-trumps-avengers/,Top Trumps: Marvel Mstiteli
Карты для покера. Fournier 818,https://gaga.ru/gaga/files/images/fullsize/5459/5.jpg,,,,,,https://gaga.ru/game/karty-dlya-pokera-fournier-818/,Karty dlja pokera. Fournier 818
Angry Birds Космос. Карточная игра,https://gaga.ru/gaga/files/images/fullsize/1945/6.jpg,,,,"Настольные космические сражения между птицами и свиньями? Разве такое возможно? Теперь – да! Angry Birds Space. Power Cards – простая, азартная, веселая и увлекательная игра для всей семьи!",https://gaga.ru//gaga/files/pdf/rules/ru/1945-312626.pdf,https://gaga.ru/game/angry-birds-space-card-game/,Angry Birds Kosmos. Kartochnaja igra
Бэнг! Шоу Дикого Запада,https://gaga.ru/gaga/files/images/fullsize/5115/4.jpg,,,,,https://gaga.ru//gaga/files/pdf/rules/ru/5115.pdf,https://gaga.ru/game/bjeng-shou-dikogo-zapada/,Beng! Shou Dikogo Zapada
Солитер Мини,https://gaga.ru/gaga/files/images/fullsize/1329/7.jpg,,,,"Солитер Мини – отличная штука, чтобы скоротать обеденный перерыв или творческую паузу на работе. Если что, напомните коллегам, что смена деятельности стимулирует  умственные процессы :)",https://gaga.ru//gaga/files/pdf/rules/ru/1329.pdf,https://gaga.ru/game/solitaire-mini/,Soliter Mini
Игра наоборот,https://gaga.ru/gaga/files/images/fullsize/6557/4.jpg,,,,,https://gaga.ru//gaga/files/pdf/rules/ru/6557.pdf,https://gaga.ru/game/igra-naoborot/,Igra naoborot
Порт Ройал. Полное издание,https://gaga.ru/gaga/files/images/fullsize/6527/12.jpg,,,,,https://gaga.ru//gaga/files/pdf/rules/ru/6527-323959.pdf,https://gaga.ru/game/port-royal-polnoe-izdanie/,Port Rojal. Polnoe izdanie
Набор ЧПОК + ЧПОК 2,https://gaga.ru/gaga/files/images/fullsize/6247/1.jpg,,,,,,https://gaga.ru/game/nabor-chpokov/,Nabor ChPOK + ChPOK 2
Бухта торговцев. Драконолог,https://gaga.ru/gaga/files/images/fullsize/6669/5.jpg,,,,,,https://gaga.ru/game/buhta-torgovcev-grakonolog/,Buhta torgovtsev. Drakonolog
Ужас Аркхэма. Последний Час,https://gaga.ru/gaga/files/images/fullsize/5108/4.jpg,,,,,https://gaga.ru//gaga/files/pdf/rules/ru/5108.pdf,https://gaga.ru/game/uzhas-arkhjema-poslednij-chas/,Uzhas Arkhema. Poslednij Chas
"ЗБС: Злобная, Бесстыжая, Смешная",https://gaga.ru/gaga/files/images/fullsize/6309/4.jpg,"ооочень простые правила^играть можно как вдвоем, так и в большой компании^",после нескольких раундов вы сможете при случае блеснуть новыми знаниями^,игра хороша только для однократного прохождения – пока не закончатся карточки с фактами^,"ЗБС: Злобная, Бесстыжая, Смешная – это игра, которая поможет вам от души посмеяться, узнать много нового и понять, насколько хорошо вы блефуете. Компактная упаковка, простые правила и быстрые партии сделают ЗБС идеальной частью вечеринки!",https://gaga.ru//gaga/files/pdf/rules/ru/6309.pdf,https://gaga.ru/game/zlobnaya-besstyzhaya-smeshnaya/,"ZBS: Zlobnaja, Besstyzhaja, Smeshnaja"
Бестиарий Сигиллума. Новые Земли,https://gaga.ru/gaga/files/images/fullsize/5187/5.jpg,,,,,https://gaga.ru//gaga/files/pdf/rules/ru/5187-312631.pdf,https://gaga.ru/game/bestiariy-sigilluma-novie-zemli/,Bestiarij Sigilluma. Novye Zemli
Каркассон. Аббатство и Мэр,https://gaga.ru/gaga/files/images/fullsize/5209/4.jpg,,,,,https://gaga.ru//gaga/files/pdf/rules/ru/5209.pdf,https://gaga.ru/game/carcassonne-abbatstvo-mar/,Karkasson. Abbatstvo i Mer
Сундучок знаний. Cities,https://gaga.ru/gaga/files/images/fullsize/5648/3.jpg,,,,,,https://gaga.ru/game/sunduchok-znanij-cities/,Sunduchok znanij. Cities
Знаток 320 схем,https://gaga.ru/gaga/files/images/fullsize/412/5.jpg,,,,"Не дарите своему малышу на день рождения новые брюки или двадцать пятую машинку. Подарите ему конструктор Знаток 320 Схем и соберите с ним радиоприёмник, чтобы принимать сигналы от инопланетян или электрическое световое ружьё, чтобы отражать атаки подкроватных монстров. Вот это будет действительно классный подарок :)",,https://gaga.ru/game/znatok-320/,Znatok 320 shem
Активити. Руки Связаны,https://gaga.ru/gaga/files/images/fullsize/5371/4.jpg,,,,,,https://gaga.ru/game/aktiviti-ruki-svyazany/,Aktiviti. Ruki Svjazany
Ужас Аркхэма. Карточная игра: Нарушенный Круг. Расплата за Грехи,https://gaga.ru/gaga/files/images/fullsize/5932/10.jpg,,,,,,https://gaga.ru/game/uzhas-arkkhema-kartochnaya-igra-narushennyj-krug-rasplata-za-grekhi/,Uzhas Arkhema. Kartochnaja igra: Narushennyj Krug. Rasplata za Grehi
Умная Сова. Любимые Сказки 2,https://gaga.ru/gaga/files/images/fullsize/6239/5.jpg,,,,,,https://gaga.ru/game/umnaya-sova-lyubimye-skazki-2/,Umnaja Sova. Ljubimye Skazki 2
Древний Ужас. Таинственные Руины,https://gaga.ru/gaga/files/images/fullsize/4493/8.jpg,,,,,https://gaga.ru//gaga/files/pdf/rules/ru/4493.pdf,https://gaga.ru/game/drevnii-uzhas-tainstvennie-ruini/,Drevnij Uzhas. Tainstvennye Ruiny
Добро Пожаловать в ДиноМир,https://gaga.ru/gaga/files/images/fullsize/5876/28.jpg,"два режима игры и несколько уровней сложности^можно играть одному^понравится как любителям жанра roll’n’write, так и фанатам вдумчивых стратегий^",в состав игры входит сразу два мини-дополнения^,оформление игры довольно аскетичное — как и у многих представителей жанра^,"Добро Пожаловать в ДиноМир — это по-настоящему непростая стратегия, которая заставит вас внимательно следить за противниками и просчитывать собственные действия на несколько ходов вперёд. Готовы выяснить, кто сумеет создать лучший динопарк с помощью кубиков и карандаша? Вступайте в игру!",https://gaga.ru//gaga/files/pdf/rules/ru/5876-345053.pdf,https://gaga.ru/game/dobro-pozhalovat-v-dinomir/,Dobro Pozhalovat' v DinoMir
Rory`s Story Cubes Космос,https://gaga.ru/gaga/files/images/fullsize/2616/3.jpg,,,,,,https://gaga.ru/game/rorys-story-cubes-intergalactic/,Rory`s Story Cubes Kosmos
Таверна Красный Дракон: Злодеи,https://gaga.ru/gaga/files/images/fullsize/5944/17.jpg,,,,,https://gaga.ru//gaga/files/pdf/rules/ru/5944.pdf,https://gaga.ru/game/taverna-krasnyj-drakon-zlodei/,Taverna Krasnyj Drakon: Zlodei
Монополия. Гонка,https://gaga.ru/gaga/files/images/fullsize/5533/3.jpg,,,,,,https://gaga.ru/game/monopoliya-gonka/,Monopolija. Gonka
Тюльпаномания,https://gaga.ru/gaga/files/images/fullsize/6614/9.jpg,,,,,https://gaga.ru//gaga/files/pdf/rules/ru/6614.pdf,https://gaga.ru/game/tyulpanomaniya/,Tjul'panomanija
Опасные Гости. Кто Убил Мистера Уолтона?,https://gaga.ru/gaga/files/images/fullsize/6272/4.jpg,,,,,https://gaga.ru//gaga/files/pdf/rules/ru/6272.pdf,https://gaga.ru/game/opasnye-gosti-kto-ubil-mistera-uoltona/,Opasnye Gosti. Kto Ubil Mistera Uoltona?
Манчкин Котэ,https://gaga.ru/gaga/files/images/fullsize/3347/7.jpg,,,,,https://gaga.ru//gaga/files/pdf/rules/ru/3347.pdf,https://gaga.ru/game/munchkin-kittens/,Manchkin Kote
Ужас Аркхэма. Карточная игра: Лабиринты Безумия,https://gaga.ru/gaga/files/images/fullsize/5931/11.jpg,,,,,,https://gaga.ru/game/uzhas-arkkhema-kartochnaya-igra-labirinty-bezumiya/,Uzhas Arkhema. Kartochnaja igra: Labirinty Bezumija
"Каркассон. Мосты, Замки и Базары",https://gaga.ru/gaga/files/images/fullsize/5284/5.jpg,,,,,https://gaga.ru//gaga/files/pdf/rules/ru/5284.pdf,https://gaga.ru/game/karkasson-mosty-zamki-i-bazary/,"Karkasson. Mosty, Zamki i Bazary"
Набор ИлиТо + ИлиТо 2,https://gaga.ru/gaga/files/images/fullsize/6248/4.jpg,,,,,,https://gaga.ru/game/nabor-ilito/,Nabor IliTo + IliTo 2
Ужас Аркхэма. Карточная Игра: Нарушенный Круг. Единство и Разочарование,https://gaga.ru/gaga/files/images/fullsize/6054/7.jpg,,,,,https://gaga.ru//gaga/files/pdf/rules/ru/6054.pdf,https://gaga.ru/game/uzhas-arkkhema-kartochnaya-igra-narushennyj-krug-edinstvo-i-razocharovanie/,Uzhas Arkhema. Kartochnaja Igra: Narushennyj Krug. Edinstvo i Razocharovanie
Погоня за Авророй. Проект «Афина»,https://gaga.ru/gaga/files/images/fullsize/5684/8.jpg,,,,,https://gaga.ru//gaga/files/pdf/rules/ru/5684.pdf,https://gaga.ru/game/pogonya-za-avroroj-proekt-afina/,Pogonja za Avroroj. Proekt «Afina»
500 Злобных Карт: Еще 200 Карт. Набор Красный,https://gaga.ru/gaga/files/images/fullsize/3408/7.jpg,,,,,,https://gaga.ru/game/500-zlobnyh-kart-dopolnenie-2/,500 Zlobnyh Kart: Esche 200 Kart. Nabor Krasnyj
Место Преступления. Прекрасная Эпоха,https://gaga.ru/gaga/files/images/fullsize/5946/18.jpg,,,,,https://gaga.ru//gaga/files/pdf/rules/ru/5946.pdf,https://gaga.ru/game/mesto-prestupleniya-prekrasnaya-epoha/,Mesto Prestuplenija. Prekrasnaja Epoha
Рик и Морти: Близкие Риконтакты Риковой Степени,https://gaga.ru/gaga/files/images/fullsize/6646/5.jpg,,,,,https://gaga.ru//gaga/files/pdf/rules/ru/6646.pdf,https://gaga.ru/game/rik-i-morti-blizkie-rikonakti-rikovoi-stepeni/,Rik i Morti: Blizkie Rikontakty Rikovoj Stepeni
Билет на Поезд: Азия,https://gaga.ru/gaga/files/images/fullsize/5462/7.jpg,,,,"Перед нами достойное продолжение популярной серии. Новые игровые поля, наверное, единственная вещь, которой не хватало оригинальной версии Билета на поезд. Так что складывайте свои вещички в холщовый мешок, вперёд – самое время покорять Азию!",https://gaga.ru//gaga/files/pdf/rules/ru/5462.pdf,https://gaga.ru/game/bilet-na-poezd-po-azii/,Bilet na Poezd: Azija
Большой Базар,https://gaga.ru/gaga/files/images/fullsize/3918/6.jpg,,,,,https://gaga.ru//gaga/files/pdf/rules/ru/3918.pdf,https://gaga.ru/game/bolshoy-bazar/,Bol'shoj Bazar
Замок Загадок,https://gaga.ru/gaga/files/images/fullsize/2863/7.jpg,,,,"Ни с чем не сравнится удовольствие от успехов своих детей. Замок Загадок дает достаточное количество задачек, чтобы родители в меру насладились победами своих отпрысков. Сказочные стены и башни уже подпрыгивают от нетерпения в ожидании тех, кто возьмет их в руки и превратит в шедевр средневековой архитектуры!",https://gaga.ru//gaga/files/pdf/rules/ru/2863-314480.pdf,https://gaga.ru/game/zamok-zagadok/,Zamok Zagadok
Умная сова. Учимся Считать,https://gaga.ru/gaga/files/images/fullsize/6240/5.jpg,,,,,,https://gaga.ru/game/umnaya-sova-uchimsya-schitat/,Umnaja sova. Uchimsja Schitat'
Мемори. Смайлики,https://gaga.ru/gaga/files/images/fullsize/3767/6.jpg,,,,,,https://gaga.ru/game/memory-smailiki/,Memori. Smajliki
Rory`s Story Cubes Ужастики,https://gaga.ru/gaga/files/images/fullsize/2864/6.jpg,,,,,,https://gaga.ru/game/rorys-story-cubes-fright/,Rory`s Story Cubes Uzhastiki
Каркассон: Бродячий Цирк,https://gaga.ru/gaga/files/images/fullsize/5343/4.jpg,,,,,https://gaga.ru//gaga/files/pdf/rules/ru/5343.pdf,https://gaga.ru/game/karkasson-brodyachij-cirk/,Karkasson: Brodjachij Tsirk
Баобаб,https://gaga.ru/gaga/files/images/fullsize/3358/7.jpg,,,,,https://gaga.ru//gaga/files/pdf/rules/ru/3358.pdf,https://gaga.ru/game/baobab/,Baobab
Зов Ктулху. Одиночное приключение: Лес вендиго,https://gaga.ru/gaga/files/images/fullsize/6484/4.jpg,,,,,,https://gaga.ru/game/zov-ktulhu-les-vendigo/,Zov Ktulhu. Odinochnoe prikljuchenie: Les vendigo
Ольтре,https://gaga.ru/gaga/files/images/fullsize/6554/9.jpg,,,,,https://gaga.ru//gaga/files/pdf/rules/ru/6554.pdf,https://gaga.ru/game/oltre/,Ol'tre
Terra Mystica. Fire & Ice,https://gaga.ru/gaga/files/images/fullsize/4035/7.jpg,,,,"Terra Mystica. Fire & Ice  – это целая коробка новых механик и компонентов для легендарной игры, с которой ваши партии станут еще разнообразнее.",https://gaga.ru//gaga/files/pdf/rules/ru/4035.pdf,https://gaga.ru/game/terra-mystica-fire-ice/,Terra Mystica. Fire & Ice
Нидавеллир: Тингвеллир,https://gaga.ru/gaga/files/images/fullsize/6197/15.jpg,,,,,https://gaga.ru//gaga/files/pdf/rules/ru/6197.pdf,https://gaga.ru/game/nidavellir-tingvellir/,Nidavellir: Tingvellir
Монополия Деньги на Воздух,https://gaga.ru/gaga/files/images/fullsize/4446/3.jpg,,,,,,https://gaga.ru/game/monopoly-dengi-na-vozdukh/,Monopolija Den'gi na Vozduh
Пентаго Третье Измерение,https://gaga.ru/gaga/files/images/fullsize/3953/8.jpg,,,,,https://gaga.ru//gaga/files/pdf/rules/ru/3953.pdf,https://gaga.ru/game/pentago-tretie-izmerenie/,Pentago Tret'e Izmerenie
Штука: Другие Миры,https://gaga.ru/gaga/files/images/fullsize/6310/6.jpg,семь невероятных способов объяснить происходящее безумие^помогает научиться мыслить нешаблонно и выходить за рамки^,"потрясающие игровые поля, которые можно разглядывать часами^",может не подойти игрокам с нарушениями визуального восприятия^,"Красочная, веселая и динамичная Штука: Другие Миры наверняка обрадует любителей игр на поиск предметов. Ежегодное посещение окулиста отменяется, ведь перед вами наилучший способ для проверки остроты зрения!",https://gaga.ru//gaga/files/pdf/rules/ru/6310.pdf,https://gaga.ru/game/shtuka-drugiye-miry/,Shtuka: Drugie Miry
Квестик волшебный,https://gaga.ru/gaga/files/images/fullsize/4421/3.jpg,,,,,https://gaga.ru//gaga/files/pdf/rules/ru/4421.pdf,https://gaga.ru/game/kvestik-volshebniy/,Kvestik volshebnyj
Глен-Мор II. Игры Горцев,https://gaga.ru/gaga/files/images/fullsize/6113/23.jpg,,,,,https://gaga.ru//gaga/files/pdf/rules/ru/6113.pdf,https://gaga.ru/game/glen-mor-2-igry-gorcev/,Glen-Mor II. Igry Gortsev
500 Злобных Карт. Дополнение. Набор Чёрный,https://gaga.ru/gaga/files/images/fullsize/2623/3.jpg,,,,"Спорный юмор не для слабонервных — вот что придаст пикантную остроту вечеринке. Без лишних слов — это игра для тех, кто не боится изрядно покраснеть, произнося неоднозначные фразы :) Это вам не встреча анонимных пингвинов!",,https://gaga.ru/game/500-zlobnyh-kart-eshe-200/,500 Zlobnyh Kart. Dopolnenie. Nabor Chernyj
3 Секрета: Время Преступления,https://gaga.ru/gaga/files/images/fullsize/6344/5.jpg,несколько уровней сложности^компактная и динамичная игра^оригинальное оформление в стиле нуар^,атмосферное приложение с музыкой и таймером^соревновательный и кооперативный режимы расследования^,"когда карточки кончатся, вам захочется стереть себе память, чтобы пройти игру еще раз^","3 Секрета: Время Преступления — стильная и компактная карточная головоломка, для которой всегда найдется время у любителей детективных историй.",https://gaga.ru//gaga/files/pdf/rules/ru/6344-342016.pdf,https://gaga.ru/game/3-sekreta-vremya-prestupleniya/,3 Sekreta: Vremja Prestuplenija
Свинтус Метаморфозы,https://gaga.ru/gaga/files/images/fullsize/2958/6.jpg,,,,"Перед нами увлекательное дополнение к хорошо знакомой игре, которое должно понравиться любителям серии. Свинтус. Метаморфозы дарят нам более разнообразные партии без увеличения хаоса на поле, а заодно позволяют побывать в шкуре сказочных животных. Итак, встречайте тактический Свинтус!",https://gaga.ru//gaga/files/pdf/rules/ru/2958.pdf,https://gaga.ru/game/svintus-metamorphozi/,Svintus Metamorfozy
Пазл Парковка,https://gaga.ru/gaga/files/images/fullsize/3678/7.jpg,,,,,,https://gaga.ru/game/parkovka-bondibon/,Pazl Parkovka
Тауантинсуйу. Империя Инков,https://gaga.ru/gaga/files/images/fullsize/5834/24.jpg,,,,,https://gaga.ru//gaga/files/pdf/rules/ru/5834-345061.pdf,https://gaga.ru/game/tauantinsuju-imperiya-inkov/,Tauantinsuju. Imperija Inkov
